{
  "schema_version": 1,
  "template": "nexgarden-preview-python312-flask-20260902-r2",
  "max_concurrency": 10,
  "sandbox_timeout_seconds": 21600,
  "bootstrap": true,
  "keep_failed_sandboxes": false,
  "model": "gpt-5.6-sol",
  "reasoning_effort": "xhigh",
  "timeout_minutes": 90,
  "max_cycles": 12,
  "workers": [
    {
      "id": "example_one",
      "url": "https://www.example.com/",
      "run_dir": "/absolute/generated/example-one-coupled-r1",
      "requirements_file": "/absolute/requirements/example-one.md"
    },
    {
      "id": "example_two",
      "url": "https://www.example.org/",
      "run_dir": "/absolute/generated/example-two-coupled-r1",
      "requirements_file": "/absolute/requirements/example-two.md",
      "storage_state": "/private/browser-states/example-two.json"
    }
  ]
}
